"Segment"	"en-ZZ"	"nl-NL"	"ID"	"File"
"1485"	"M982 Employment Data Q3"	"M982 WERKGELEGENHEID Q4"	"Q4M982_question_unknownID_50c792b5a65985.04205789_0"	"PISA_nld-NLD_MAT_M982-EmploymentData_en15_MS2022.xlf"
"73"	"&lt;br /&gt; &lt;br /&gt; Show how you found your answer.&lt;br /&gt;"	"&lt;br /&gt; &lt;br /&gt; Laat zien hoe je tot je antwoord bent gekomen.&lt;br /&gt;"	"Q3M155_question_Q3itemStem_50c7a1c7c94ae4.56911705_0"	"PISA_nld-NLD_MAT_M155-PopulationPyramids_en15_MS2022.xlf"
"1287"	"&lt;br /&gt; &lt;br /&gt; Show how you found your answer.&lt;br /&gt;"	"&lt;br /&gt; &lt;br /&gt; Laat zien hoe je aan je antwoord bent gekomen.&lt;br /&gt;"	"Q3M953_question_Q3itemStem_50c77dee96cbb9.66213561_0"	"PISA_nld-NLD_MAT_M953-FluTest_en15_MS2022.xlf"
"462"	"&lt;i&gt;Type your answer to the question.&lt;/i&gt;"	"&lt;i&gt;Gebruik de cijfertoetsen om je antwoord op de vraag te typen.&lt;/i&gt;"	"Q1M464_question_Q1itemDirections_50c7a4eba1b004.20405591_0"	"PISA_nld-NLD_MAT_M464-Fence_en15_MS2022.xlf"
"70"	"&lt;i&gt;Refer to &quot;Population Pyramids&quot; on the right. Type your answer to the question.&lt;/i&gt;"	"&lt;i&gt;Raadpleeg 'Bevolkingspiramides' aan de rechterkant. Typ je antwoord op de vraag.&lt;/i&gt;"	"Q3M155_question_Q3itemDirections_50c7a1c7c94266.82906163_0"	"PISA_nld-NLD_MAT_M155-PopulationPyramids_en15_MS2022.xlf"
